{
  "manifestVersion": "2",
  "name": "dep-app",
  "version": "1.0.0",
  "entry": "dist/index.mjs",
  "dist": { "hash": "sha256:cd3ec8010af1ab0c2e535046659f22f1eeb087340f1e389ea44fcd091677e638" },
  "description": "Example app plugin previously depending on dep-lib (relationship temporarily omitted pending schema support)",
  "permissions": {}
}
